{
  "number": "SA-101",
  "title": "Studio Access Protocol",
  "version": "1.0",
  "category": "Operations",
  "owner": "Spotlight Advocate",
  "approved": "Draft",
  "purpose": "Define how personnel enter and use studio spaces.",
  "scope": "Applies to Spotlight Advocate staff and authorized contractors on production days.",
  "sections": [
    {
      "heading": "Overview",
      "body": "Replace this section with the first substantive clause."
    }
  ],
  "revision_history": [
    {
      "version": "1.0",
      "date": "2026-07-21",
      "author": "Spotlight Advocate",
      "notes": "Initial draft."
    },
    {
      "version": "1.0",
      "date": "2026-07-21",
      "author": "Spotlight Advocate",
      "notes": "Framework placeholder."
    }
  ]
}
